{
  "id": "018fde16-0000-4000-8000-000000000000",
  "from": "did:wba:agentidentityregistry.org:agents:AIR-B0B0-B002-0002",
  "to": "did:wba:agentidentityregistry.org:agents:AIR-CAR0-L003-0003",
  "timestamp": "2026-05-28T09:22:00.000Z",
  "in_reply_to": "018fde0c-0000-4000-8000-000000000000",
  "thread_id": "018fde02-1111-4000-8000-111111111111",
  "nonce": "nonce-draft1-example-22",
  "body": {
    "type": "Accept",
    "accepted_price": {
      "amount_cents": 7000,
      "currency": "EUR"
    }
  },
  "signature": "z222222222222222222222222222222222222222222222222222222222222222222222222222222222222222"
}
