{
  "id": "018fde32-0000-4000-8000-000000000000",
  "from": "did:wba:agentidentityregistry.org:agents:AIR-B0B0-B002-0002",
  "to": "did:wba:agentidentityregistry.org:agents:AIR-CAR0-L003-0003",
  "timestamp": "2026-05-28T09:50:00.000Z",
  "in_reply_to": "018fde0a-0000-4000-8000-000000000000",
  "thread_id": "018fde0a-1111-4000-8000-111111111111",
  "nonce": "nonce-draft1-example-50",
  "body": {
    "type": "Withdraw",
    "withdrawn_id": "018fde0a-0000-4000-8000-000000000000",
    "reason": "Service no longer available from this agent."
  },
  "signature": "z222222222222222222222222222222222222222222222222222222222222222222222222222222222222222"
}
