{
  "id": "018fde1a-0000-4000-8000-000000000000",
  "from": "did:wba:agentidentityregistry.org:agents:AIR-B0B0-B002-0002",
  "to": "did:wba:agentidentityregistry.org:agents:AIR-DAV3-D004-0004",
  "timestamp": "2026-05-28T09:26:00.000Z",
  "in_reply_to": "018fde10-0000-4000-8000-000000000000",
  "thread_id": "018fde06-1111-4000-8000-111111111111",
  "nonce": "nonce-draft1-example-26",
  "body": {
    "type": "Accept",
    "accepted_price": {
      "amount_cents": 850000,
      "currency": "USD"
    }
  },
  "signature": "z222222222222222222222222222222222222222222222222222222222222222222222222222222222222222"
}
