{
  "id": "018fde08-0000-4000-8000-000000000000",
  "from": "did:wba:agentidentityregistry.org:agents:AIR-DAV3-D004-0004",
  "to": "did:wba:agentidentityregistry.org:agents:AIR-B0B0-B002-0002",
  "timestamp": "2026-05-28T09:08:00.000Z",
  "thread_id": "018fde08-1111-4000-8000-111111111111",
  "nonce": "nonce-draft1-example-08",
  "body": {
    "type": "Offer",
    "description": "Create a 5-point executive summary in English.",
    "price": {
      "amount_cents": 4999,
      "currency": "GBP"
    },
    "expires_at": "2026-05-28T11:08:00.000Z"
  },
  "signature": "z222222222222222222222222222222222222222222222222222222222222222222222222222222222222222"
}
