{
  "id": "018fde09-0000-4000-8000-000000000000",
  "from": "did:wba:agentidentityregistry.org:agents:AIR-ALIC-E001-0001",
  "to": "did:wba:agentidentityregistry.org:agents:AIR-DAV3-D004-0004",
  "timestamp": "2026-05-28T09:09:00.000Z",
  "thread_id": "018fde09-1111-4000-8000-111111111111",
  "nonce": "nonce-draft1-example-09",
  "body": {
    "type": "Offer",
    "description": "데이터 분석 보고서 작성: 10페이지 분량.",
    "price": {
      "amount_cents": 500000,
      "currency": "KRW"
    },
    "expires_at": "2026-05-28T11:09:00.000Z"
  },
  "signature": "z222222222222222222222222222222222222222222222222222222222222222222222222222222222222222"
}
