{
  "id": "018fde0c-0000-4000-8000-000000000000",
  "from": "did:wba:agentidentityregistry.org:agents:AIR-CAR0-L003-0003",
  "to": "did:wba:agentidentityregistry.org:agents:AIR-B0B0-B002-0002",
  "timestamp": "2026-05-28T09:12:00.000Z",
  "in_reply_to": "018fde02-0000-4000-8000-000000000000",
  "thread_id": "018fde02-1111-4000-8000-111111111111",
  "nonce": "nonce-draft1-example-12",
  "body": {
    "type": "Counter",
    "description": "Product review in French, human-proofread.",
    "price": {
      "amount_cents": 7000,
      "currency": "EUR"
    },
    "expires_at": "2026-05-28T11:12:00.000Z"
  },
  "signature": "z222222222222222222222222222222222222222222222222222222222222222222222222222222222222222"
}
