{
  "id": "018fde2d-0000-4000-8000-000000000000",
  "from": "did:wba:agentidentityregistry.org:agents:AIR-ALIC-E001-0001",
  "to": "did:wba:agentidentityregistry.org:agents:AIR-CAR0-L003-0003",
  "timestamp": "2026-05-28T09:45:00.000Z",
  "in_reply_to": "018fde05-0000-4000-8000-000000000000",
  "thread_id": "018fde05-1111-4000-8000-111111111111",
  "nonce": "nonce-draft1-example-45",
  "body": {
    "type": "Withdraw",
    "withdrawn_id": "018fde05-0000-4000-8000-000000000000",
    "reason": "Budget reallocation required before proceeding."
  },
  "signature": "z222222222222222222222222222222222222222222222222222222222222222222222222222222222222222"
}
