{
  "id": "018fde2b-0000-4000-8000-000000000000",
  "from": "did:wba:agentidentityregistry.org:agents:AIR-CAR0-L003-0003",
  "to": "did:wba:agentidentityregistry.org:agents:AIR-DAV3-D004-0004",
  "timestamp": "2026-05-28T09:43:00.000Z",
  "in_reply_to": "018fde03-0000-4000-8000-000000000000",
  "thread_id": "018fde03-1111-4000-8000-111111111111",
  "nonce": "nonce-draft1-example-43",
  "body": {
    "type": "Withdraw",
    "withdrawn_id": "018fde03-0000-4000-8000-000000000000",
    "reason": "요청 내용이 변경되어 제안을 철회합니다."
  },
  "signature": "z222222222222222222222222222222222222222222222222222222222222222222222222222222222222222"
}
